{
  "schema_version": "1.0.0",
  "inventory_id": "supplemental-official-policy-inventory-20260817",
  "inventory_date": "2026-08-17",
  "input_evidence": {
    "file_name": "청년정책_데이터수집_완료.xlsx",
    "sha256": "c03aa55fba844639a89a4f62ec083dc74c5397b3ea7fbfab91450fbef97f2095",
    "sheet_name": "청년정책 세부 수집방안",
    "range": "A1:F71",
    "url_row_count": 64,
    "excluded_fields": [
      "수집 방법 (가능한 모든 방법)",
      "비고 (신청 필요 서류 및 안내)"
    ],
    "exclusion_reason": "공식 원문으로 검증되지 않은 수집 힌트와 필요서류는 정책 evidence로 import하지 않는다."
  },
  "quality_summary": {
    "url_row_count": 64,
    "candidate_identity_count": 60,
    "collapsed_exact_duplicate_rows": 4,
    "same_url_title_conflict_count": 3,
    "direct_aggregator_row_count": 11,
    "inventory_status_counts": {
      "candidate": 55,
      "data_error": 4,
      "discovery_reference": 1
    }
  },
  "same_url_title_conflicts": [
    {
      "canonical_url": "https://www.bokjiro.go.kr/ssis-tbu/twataa/wlfareInfo/moveTWAT52011M.do?wlfareInfoId=WLF00005567",
      "candidate_ids": [
        "xlsx-row-012-1c61630eb082",
        "xlsx-row-013-481148a890e3"
      ],
      "input_rows": [
        12,
        13
      ]
    },
    {
      "canonical_url": "https://www.work24.go.kr/cm/c/f/1100/selecSystInfo.do?currentPageNo=1&recordCountPerPage=9&systClId=SC00000117&systId=SI00000318&upprSystClId=",
      "candidate_ids": [
        "xlsx-row-015-64777b1ebd8c",
        "xlsx-row-016-0c73f44ac3f4"
      ],
      "input_rows": [
        15,
        16
      ]
    },
    {
      "canonical_url": "https://enhuf.molit.go.kr/index.jsp",
      "candidate_ids": [
        "xlsx-row-054-5da7b658c0e3",
        "xlsx-row-059-6b5af352821e"
      ],
      "input_rows": [
        54,
        58,
        59
      ]
    }
  ],
  "policy_candidates": [
    {
      "candidate_id": "xlsx-row-002-96ef237a57a4",
      "input_rows": [
        2
      ],
      "category": "주거 지원",
      "title": "26년 청년월세 지원사업",
      "agency": "국토교통부 / 복지로",
      "url": "https://www.bokjiro.go.kr/ssis-tbu/twataa/wlfareInfo/moveTWAT52011M.do?wlfareInfoId=WLF00004661",
      "canonical_url": "https://www.bokjiro.go.kr/ssis-tbu/twataa/wlfareInfo/moveTWAT52011M.do?wlfareInfoId=WLF00004661",
      "hostname": "www.bokjiro.go.kr",
      "source_group": "approved-aggregator-comparison",
      "external_identity": {
        "kind": "wlfareInfoId",
        "value": "WLF00004661"
      },
      "inventory_status": "candidate",
      "decision_reason": "SOP1 중복 감사와 Source preflight 대상이다.",
      "untrusted_input": {
        "collection_method_sha256": "sha256:4d0994be86b628f665325d26a6459f6080104063d004ed46c9b643e549220b1d",
        "note_sha256": "sha256:21965a8b615c26771b3e28a96c461fa9139702cb676fbd6a6a098ebde0ec57d5",
        "note_present": true
      }
    },
    {
      "candidate_id": "xlsx-row-003-71fc53f4606b",
      "input_rows": [
        3
      ],
      "category": "주거 지원",
      "title": "미혼청년 주거급여 분리지급",
      "agency": "국토교통부 / 복지로",
      "url": "https://www.bokjiro.go.kr/ssis-tbu/twataa/wlfareInfo/moveTWAT52011M.do?wlfareInfoId=WLF00003201",
      "canonical_url": "https://www.bokjiro.go.kr/ssis-tbu/twataa/wlfareInfo/moveTWAT52011M.do?wlfareInfoId=WLF00003201",
      "hostname": "www.bokjiro.go.kr",
      "source_group": "approved-aggregator-comparison",
      "external_identity": {
        "kind": "wlfareInfoId",
        "value": "WLF00003201"
      },
      "inventory_status": "candidate",
      "decision_reason": "SOP1 중복 감사와 Source preflight 대상이다.",
      "untrusted_input": {
        "collection_method_sha256": "sha256:cef72597796a2eceb6eeed13071255b5f5441466cad4e1216b54edf40a9c5220",
        "note_sha256": "sha256:f3ff6fe98cbc7f336652fa51bc5843e17b8ed6ab09611bbc3934371f99838923",
        "note_present": true
      }
    },
    {
      "candidate_id": "xlsx-row-004-07290460a74e",
      "input_rows": [
        4
      ],
      "category": "주거 지원",
      "title": "LH 청년 매입임대주택",
      "agency": "국토교통부 / 한국토지주택공사(LH)",
      "url": "https://apply.lh.or.kr/lhapply/cm/cntnts/cntntsView.do?cntntsId=201251&mi=1150",
      "canonical_url": "https://apply.lh.or.kr/lhapply/cm/cntnts/cntntsView.do?cntntsId=201251&mi=1150",
      "hostname": "apply.lh.or.kr",
      "source_group": "lh-housing-announcements",
      "external_identity": null,
      "inventory_status": "candidate",
      "decision_reason": "SOP1 중복 감사와 Source preflight 대상이다.",
      "untrusted_input": {
        "collection_method_sha256": "sha256:1e62aebc2284a7b1ac844d9c23957570b5ef6f843d0b6966c393a1c8d4ddee64",
        "note_sha256": "sha256:4d4127211640f20569927472997d5fd2b306bf61bd202c9c8c4b5dce7947019c",
        "note_present": true
      }
    },
    {
      "candidate_id": "xlsx-row-005-704ca3f1f595",
      "input_rows": [
        5
      ],
      "category": "주거 지원",
      "title": "LH 청년 행복주택",
      "agency": "국토교통부 / 한국토지주택공사(LH)",
      "url": "https://apply.lh.or.kr/lhapply/cm/cntnts/cntntsView.do?mi=1201662&cntntsId=1201371",
      "canonical_url": "https://apply.lh.or.kr/lhapply/cm/cntnts/cntntsView.do?cntntsId=1201371&mi=1201662",
      "hostname": "apply.lh.or.kr",
      "source_group": "lh-housing-announcements",
      "external_identity": null,
      "inventory_status": "candidate",
      "decision_reason": "SOP1 중복 감사와 Source preflight 대상이다.",
      "untrusted_input": {
        "collection_method_sha256": "sha256:1e62aebc2284a7b1ac844d9c23957570b5ef6f843d0b6966c393a1c8d4ddee64",
        "note_sha256": "sha256:4a5eb261cb4925cdebefb44d71ebf1297d16c0ebf4f417bff10501368411401c",
        "note_present": true
      }
    },
    {
      "candidate_id": "xlsx-row-006-3dc9ad4b8195",
      "input_rows": [
        6
      ],
      "category": "주거 지원",
      "title": "전세보증금반환보증 보증료 지원",
      "agency": "국토교통부 / 주택도시기금",
      "url": "https://www.gov.kr/portal/rcvfvrSvc/dtlEx/161300000103",
      "canonical_url": "https://www.gov.kr/portal/rcvfvrSvc/dtlEx/161300000103",
      "hostname": "www.gov.kr",
      "source_group": "government-data-and-service",
      "external_identity": null,
      "inventory_status": "candidate",
      "decision_reason": "SOP1 중복 감사와 Source preflight 대상이다.",
      "untrusted_input": {
        "collection_method_sha256": "sha256:589ec148dd22c3d22bfdb5fecb9975f6d370c468a86768d3f4432dc8ae5d1926",
        "note_sha256": "sha256:54689bc8afaad42d2491827cb2000011c4cef75fbd4708c862e89201de8dfb14",
        "note_present": true
      }
    },
    {
      "candidate_id": "xlsx-row-007-55ad8dbfb893",
      "input_rows": [
        7
      ],
      "category": "금융·자산 형성 지원",
      "title": "청년내일저축계좌",
      "agency": "보건복지부 / 복지로 / 자산형성지원센터",
      "url": "https://www.bokjiro.go.kr/ssis-tbu/ssis-tbu/twataa/wlfareInfo/moveTWAT52011M.do?wlfareInfoId=WLF00000060",
      "canonical_url": "https://www.bokjiro.go.kr/ssis-tbu/ssis-tbu/twataa/wlfareInfo/moveTWAT52011M.do?wlfareInfoId=WLF00000060",
      "hostname": "www.bokjiro.go.kr",
      "source_group": "approved-aggregator-comparison",
      "external_identity": {
        "kind": "wlfareInfoId",
        "value": "WLF00000060"
      },
      "inventory_status": "candidate",
      "decision_reason": "SOP1 중복 감사와 Source preflight 대상이다.",
      "untrusted_input": {
        "collection_method_sha256": "sha256:e4de2ab22fbd9cb45f984b6727a5c6f473d9c86ff42e3c0491eb4539881e4f28",
        "note_sha256": "sha256:6c9374ba8dac4aa0a398d31c0edffdb825a205f35d5c1722739f4c13ae38dcb2",
        "note_present": true
      }
    },
    {
      "candidate_id": "xlsx-row-008-1acdfe8c2f9d",
      "input_rows": [
        8
      ],
      "category": "복지·생활 지원",
      "title": "고용보험 미적용자 출산급여 지원",
      "agency": "고용노동부",
      "url": "https://www.work24.go.kr/cm/c/f/1100/selecSystInfo.do?currentPageNo=1&recordCountPerPage=10&systId=SI00000390&systClId=SC00000250",
      "canonical_url": "https://www.work24.go.kr/cm/c/f/1100/selecSystInfo.do?currentPageNo=1&recordCountPerPage=10&systClId=SC00000250&systId=SI00000390",
      "hostname": "www.work24.go.kr",
      "source_group": "work24-policy",
      "external_identity": {
        "kind": "systId",
        "value": "SI00000390"
      },
      "inventory_status": "candidate",
      "decision_reason": "SOP1 중복 감사와 Source preflight 대상이다.",
      "untrusted_input": {
        "collection_method_sha256": "sha256:7215a8e39f8c4f7754bbde2e01d3df3cfb9811c97a83fdf31309cb1cadd20766",
        "note_sha256": "sha256:549274bcce8d5f3b05356dbfe5b59f021bbf6638e79e40ea27ca549ce9fc6f88",
        "note_present": true
      }
    },
    {
      "candidate_id": "xlsx-row-009-7db115678713",
      "input_rows": [
        9
      ],
      "category": "복지·생활 지원",
      "title": "자립준비청년 자립수당 지급",
      "agency": "보건복지부 / 인구아동정책관",
      "url": "https://www.bokjiro.go.kr/ssis-tbu/twataa/wlfareInfo/moveTWAT52011M.do?wlfareInfoId=WLF00001175",
      "canonical_url": "https://www.bokjiro.go.kr/ssis-tbu/twataa/wlfareInfo/moveTWAT52011M.do?wlfareInfoId=WLF00001175",
      "hostname": "www.bokjiro.go.kr",
      "source_group": "approved-aggregator-comparison",
      "external_identity": {
        "kind": "wlfareInfoId",
        "value": "WLF00001175"
      },
      "inventory_status": "candidate",
      "decision_reason": "SOP1 중복 감사와 Source preflight 대상이다.",
      "untrusted_input": {
        "collection_method_sha256": "sha256:da5f708937aaccce67252abe546d1cc6ab852fe7cb6b79fc09259422712d14f6",
        "note_sha256": "sha256:3d7295d752346d494ad3f9705dfaed3ad03c37afc5333a2a5f54a897710dd0a1",
        "note_present": true
      }
    },
    {
      "candidate_id": "xlsx-row-010-3462d33e6184",
      "input_rows": [
        10
      ],
      "category": "복지·생활 지원",
      "title": "빈곤 청년에 대한 근로인센티브 확대",
      "agency": "보건복지부 / 복지정책관",
      "url": "https://www.youthcenter.go.kr/youthPolicy/ythPlcyTotalSearch/ythPlcyDetail/20250617005400110946?isNew=N",
      "canonical_url": "https://www.youthcenter.go.kr/youthPolicy/ythPlcyTotalSearch/ythPlcyDetail/20250617005400110946?isNew=N",